label,country,city,dataset,provider,application,name,url,github,domain,title,desc,reading
44,美国,芝加哥,芝加哥土地用途区划数据（shapefile）,政府,创建可视化,2nd City Zoning,http://secondcityzoning.org/,https://github.com/open-city/second-city-zoning,住房,2nd City Zoning 帮你理解令人头晕的土地区划,美国城市的土地区划十分复杂，特别是对于希望创业开公司的人来说，要找到合适的房屋（符合本地土地区划规定可以用作商业）开业是一件十分困难的事情，而且往往市政府发布的区划信息又十分难懂，Open City利用芝加哥市开放的土地区划数据，通过简明的颜色区块来可视化土地区划大大降低了人们理解该信息的难度。,http://chicagotonight.wttw.com/2013/01/23/second-city-2000
45,美国,,免费午餐点、公共图书馆,政府,创建App,Range,http://www.caravanstudios.org/#!range/c1ht6,,青少年，健康，社区建设,Range带领青少年走进身边的社会福利,对于低收入家庭，如何确保他们的孩子能够在暑假时依然享受到诸如USDA提供的免费营养餐？Range这款应用将政府开放的免费午餐点数据提供在移动端，供人们了解相关信息并进一步传播。同时也整合一些公共服务设施例如图书馆，供青少年在暑假找寻到公共空间进行学习、娱乐。,http://www.caravanstudios.org/#!range/c1ht6
46,英国,伦敦,公交路线、公交时刻表等交通数据,政府,创建App,citymapper,https://citymapper.com,,交通出行,开放交通数据带来的高效出行,方便出行是每一个市民关心的问题，CItymapper使用开放的交通数据可以帮助市民合理规划出行时间、路线、交通工具。,https://citymapper.com/i/354/we-won-the-tokyo-metro-open-data-contest-special-prize
47,英国,,16岁后各院校科目考试绩效数据（post-16 performance of schools and colleges in different subjects）,政府,创建App,Skills Route,http://www.skillsroute.com/,,教育,就业还是读书？基于开放数据的Skills Route帮你做好人生决定,对于大多数学生而言，未来想要攻读怎样的学校、学科，选择怎样的一份职业都是极为迷茫的。特别是在中考之后，是期望继续读高中将来接受更高一等教育，还是选择中专技校开始工作是一个令人不知如何决断的问题。在英国，很多学生因为迷茫错误选择了人生的下一步导致高退学率，失业率，skills route 通过整合开放的16岁后学校绩效数据，帮助学生寻找适合他们现有学习水平的学校，并根据学生感兴趣的科目预测将来他们的学习情况，并告知相应的职业路径和选择，从而更好帮助家长和学生在人生升学的重要时刻作出正确的决定。,http://www.nesta.org.uk/news/new-tool-helps-16-year-olds-choose-courses-predicting-future-salary-and-grades
48,英国,,学校位置数据，NHS GP 医疗服务数据，医疗工会级别医院数据，火车和公车站数据，劳动就业机会密度统计等用于描述周边生活环境的数据,政府,创建App,MoveMaker,,,城市建设,MoveMaker让社会福利房得到高效利用,廉租房/社会保障性住房是供给低收入或住房困难人士的，但在英国，很多住户可能因为工作、家庭成员变动等原因而导致目前居住的房子无法再满足自身需求或高于现有需求，在这样的情况下，如何能够有效让不同住户间根据需要交换房屋就成了一项难题。MoveMaker通过整合政府开放的数据，为每个社会房屋评出一个基于周边环境和房屋本身情况的综合得分，从而帮助交换者挑选心仪的交换对象，再通过平台帮助双方建立联系，从而让房屋交换对于双方都利益最大化。,http://www.nesta.org.uk/news/social-housing-app-brings-touch-tinder-house-swaps-and-wins-ps40000-open-data-innovation-prize
49,美国,芝加哥,芝加哥罪案记录数据（2011-至今）：罪案编号，类型，地点，经纬度，逮捕记录，FBI编码，所属警区,政府,创建可视化,Crime in Chicago,http://www.crimeinchicago.org,https://github.com/open-city/crime-in-chicago,治安,了解身边的罪案：芝加哥开放罪案可视化,通常人们会比较了解发生在所在城市的一起热门案件，或者对城市整体的治安情况有大致的了解，但是对于自己所居住社区，以及不同时间段、不同犯罪类型的罪案则往往不那么有概念。Open City 所开发的这一可视化作品，将罪案记录以警区分组，向人们展现了罪案在不同警区、不同时间上的变化，从而帮助人们更好认识这一社会问题，并采取必要的应对行动。,http://www.crimeinchicago.org/about
50,美国,多个城市,城市建设许可、城市建设环评等与城市规划建设审批相关的数据,NGO,创建App,BuildingEye,http://buildingeye.com/,,城市建设,不出家门，用BuildingEye了解城市建设状况,城市的发展速度越来越快，但是市民们对于身边到底又有哪些城市发展项目往往一无所知，就算市政府可能提供了清单，但也未必能够一目了然让市民了解情况和进展。BuildingEye将政府开放的相关数据可视化呈现在地图上，让市民（特别是城市发展建设相关人员）能够发现身边的建设项目，及其相关审批状态和进度，并且订阅特定类型发展项目、审批情况的通知，从而可以有效参与城市建设。同时，这一工具也可以帮助市政府本身追踪和解决一些城市发展管理上的问题。,http://www.socrata.com/blog/buildingeye-mapping-clearer-city-plan/
51,加拿大,多个城市,垃圾倾倒区划，垃圾倾倒日程安排,政府,创建App,Recollect,https://recollect.net/,,民生服务,Recollect基于开放数据的垃圾回收提醒服务,在加拿大，倾倒不同类型的垃圾需要遵守市政府的日程安排，但民众往往记不清具体日期而错过倾倒某种垃圾的日子或者错误将某种垃圾提前放置出去。Recollect利用市政府开放的日程和区划数据，为民众定制个性化的提醒通知，通过短信、邮件等渠道及时通知市民该倾倒何种垃圾，并在雨雪天气等异常情况下，及时通知民众该如何应对。,http://www.socrata.com/blog/recollect-fuels-stronger-communities/
52,美国,多个城市,树木地理位置数据,政府,创建App,OpenTreeMap,http://opentreemap.github.io/,http://opentreemap.github.io/,环境,开放城市绿色地图：了解我们的城市树木,城市树木的栽种直接影响到市民是否有地方可以纳凉，是否能够改善空气，是否能够降低温度，是否能够改善城市面貌等等。opentreemap提供了一套开源解决方案，帮助城市可视化现有树木资源，并邀请各界人士通过众包方式补足树木数据，从而为城市提供一套环境受益指数（净化多少二氧化碳，改善多少空气质量等等）,http://www.deeproot.com/blog/blog-entries/what-could-a-tree-inventory-look-like-interview-with-an-open-tree-map-project-lead
53,尼泊尔,,地震伤亡数据，资源需求数据，路面损毁情况数据，援助款项数据等人道主义救援相关的数据,NGO,提升现有服务或App,,,,人道救援,让开放数据协调尼泊尔地震救援,尼泊尔地震发生后，各方救援力量如何能够高效协同了解资源短缺情况，路面交通情况等从而一同协作救援？HDX（人道救援数据交换平台）在去年应对ebola时首次上线，在今年应对尼泊尔地震时更是帮助了各方NGO协同资源共享信息，有效开展救援工作。,http://www.fastcodesign.com/3045699/how-the-candy-crush-of-data-is-saving-lives-in-nepal
54,美国,,建筑许可数据，建筑公司资质数据,政府,创建App,Porch,http://porch.com,,消费,基于开放数据的Porch帮你更好挑选工程队,要对自家房屋进行修缮、改建、新建时如何选择合适的工程公司？Porch利用市政府提供的开放数据（建筑许可、建筑公司资质）和合作数据帮助你了解你周边社区中都有哪些工程项目，他们分别由谁完成，所需要的金额是多少、完成情况又如何，从而进一步帮助你挑选合适的工程公司。,http://www.wsj.com/articles/SB10001424052702304887104579307000606208592
55,美国,,餐饮卫生检查数据：名称，地址，检查时间，检查结果，违例处理情况等,政府,创建App,HDScores,http://hdscores.com/,,食品安全,HDScores探索开放餐厅卫生数据的统筹分析,美国各城市的餐饮卫生检查等级划分极为不同，这对于到不同城市旅游出差的人们极为不方便，也很容易造成困惑。HDScore通过聚合整理美国不同地方开放的餐卫生检查数据，建立了一套新的统一标准，为民众提供一套各地适用的检查结果。,http://www.socrata.com/blog/data-dollars-serving-open-data-restaurants/
56,美国,,食品药品召回数据,政府,创建App,We Make It Safer,http://wemakeitsafer.com/,,食品安全,产品安全吗？先来we make it safer查查开放的产品召回记录,对于消费者购买的药品、食品、乃至其他产品，如何确保消费者第一时间了解该产品有质量问题，已经被召回？we make it safer 整合政府开放的相应产品召回数据，帮助人们订阅相关产品并获得第一时间的警告短信，从而帮助消费者避免产品带来的意外，并帮助人们在购买产品前作出更好决策。,http://www.nextgov.com/big-data/2014/05/mining-federal-procurement-data-companies-and-profit/83902/
57,全球,,企业登记注册数据：企业名称，法人，注册地址，董事会成员等,政府,创建可视化,OpenCorporate,https://opencorporates.com/viz/financial/,,金融,OpenCorporates帮你了解复杂的金融公司架构,金融企业如何通过复杂的子母公司结构+海外免税注册来避税？OpenCorporate通过采集、整合不同国家的企业注册数据（有一些是开放数据）设计了该可视化应用，揭露出包括高盛在内的金融企业是如何组建骇人的复杂公司网络的。,http://www.wired.co.uk/news/archive/2013-07/11/opencorporates